{
  "v": 1,
  "id": "board-1",
  "boot": 3735928559,
  "seq": 812,
  "t": 123456,
  "f": [
    0.73,
    0.0,
    0.55,
    0.0,
    0.68,
    0.74,
    0.3,
    0.12,
    0.9
  ],
  "b": "0x00000000A5",
  "e": [
    120,
    -14,
    3
  ],
  "s": [
    2,
    1,
    0
  ],
  "mac": "a1b2c3d4e5f60718"
}
